{
  "decision_id": "DEC-000",
  "title": "Example shared decision",
  "status": "accepted",
  "owner": "coordinator",
  "rationale": "The decision establishes one authoritative project-wide rule.",
  "affected_paths": [
    "AGENTS.md"
  ],
  "created_at": "2026-07-15T10:25:00+09:00",
  "supersedes": null
}
